{
  "schema": "academic-latex-slides/template@1",
  "id": "sjtu",
  "name": "Shanghai Jiao Tong University",
  "summary": "Formal institutional theme with a strong cover system",
  "good_fit": ["polished lectures", "formal academic events"],
  "status": "stable",
  "engine": "xelatex",
  "documentclass": "ctexbeamer",
  "entry": "main.tex.template",
  "placeholders": ["TITLE", "SHORT_TITLE", "SUBTITLE", "AUTHOR",
                   "INSTITUTE", "SHORT_INSTITUTE", "DATE", "SECTION_INPUTS"],
  "capabilities": {
    "subtitle": "optional",
    "empty_subtitle": "omit-line",
    "section_divider": true,
    "title_graphic": false,
    "cjk": true
  },
  "escape_profile": "latex-standard",
  "assets": [
    { "file": "beamerthemesjtubeamer.sty", "purpose": "beamer theme",
      "source": "SJTUBeamer theme",
      "license": "SJTU Beamer theme; minimal runtime subset bundled for compile-out-of-the-box" },
    { "file": "beamercolorthemesjtubeamer.sty", "purpose": "beamer color theme",
      "source": "SJTUBeamer theme",
      "license": "SJTU Beamer theme; minimal runtime subset bundled for compile-out-of-the-box" },
    { "file": "beamerfontthemesjtubeamer.sty", "purpose": "beamer font theme",
      "source": "SJTUBeamer theme",
      "license": "SJTU Beamer theme; minimal runtime subset bundled for compile-out-of-the-box" },
    { "file": "beamerinnerthemesjtubeamer.sty", "purpose": "beamer inner theme",
      "source": "SJTUBeamer theme",
      "license": "SJTU Beamer theme; minimal runtime subset bundled for compile-out-of-the-box" },
    { "file": "beamerouterthemesjtubeamer.sty", "purpose": "beamer outer theme",
      "source": "SJTUBeamer theme",
      "license": "SJTU Beamer theme; minimal runtime subset bundled for compile-out-of-the-box" },
    { "file": "sjtucover.sty", "purpose": "title cover system",
      "source": "SJTUBeamer theme",
      "license": "SJTU Beamer theme; minimal runtime subset bundled for compile-out-of-the-box" },
    { "file": "sjtuvi.sty", "purpose": "visual-identity macros",
      "source": "SJTUBeamer theme",
      "license": "SJTU Beamer theme; minimal runtime subset bundled for compile-out-of-the-box" },
    { "file": "vi", "purpose": "visual-identity asset directory (logos, badges, backgrounds)",
      "source": "SJTU visual identity",
      "license": "institutional identity; minimal runtime subset bundled for compile-out-of-the-box; removable" }
  ],
  "min_scaffold": "1.0.0",
  "maintainer": "Gareth Jiang"
}
